{
  "Name": "Start",
  "Tags": ["project"],
  "Session": {
    "index": 1,
    "date": "2026-09-29"
  },
  "Spec_version": "v15",
  "Delta": "The main tension became explicit without forcing a conclusion.",
  "Status": "LIVE",
  "Key_Signals": [
    "Chcę, żeby moje własne słowa stały się bardziej widoczne."
  ],
  "Structural_Novelties": [
    {
      "statement": "The session links visibility of language with recognition of structure.",
      "origin": ["Key_Signals[0]"],
      "status": "proposed"
    }
  ],
  "Forces_State": {
    "model": "working",
    "active": "szukanie",
    "stalled": "nazwanie",
    "key_sentences": [
      "Chcę, żeby moje własne słowa stały się bardziej widoczne."
    ],
    "what_moved": "Co staje się widoczne, kiedy przestajesz dodawać?",
    "anomalies": []
  },
  "Incidents": {
    "graft_caught": 0,
    "echo_caught": 0,
    "track_lost": 0
  },
  "Antigens": [],
  "Epochs": [],
  "Blacklist": [],
  "Caution": "",
  "Next": {
    "edge": "what becomes visible when the wording is returned in context",
    "command": "/CORE",
    "action": "Return one grounded relationship between the user's own sentences."
  }
}
